,store_id,store_name,score,ward,review_cnt,review,user_info
256,00000013,むろまち 加地,3.85,東京都内,142,京都に来た際には寄らせて頂いているむろまち加地昨年は予定が合わず来れなかったので2年ぶりの訪問。直前の予約だったが日曜日だった為、当日の20時以降空き次第で席が取れた。当日は20:00頃お電話を頂いて、20:30に訪問。■今回頂いたもの。●八寸●お造り5種盛り合せ（お刺身3種・鯖寿司・珍味）●だし巻き●自家製のからすみ餅●土鍋ごはん　（赤貝）●本日の食材からアスパラ●本日の食材から飯蛸まずは生ビールと八寸で乾杯。ここの八寸は見た目も味も良くテンションが上がる。定番のお造り盛り合せをお願いし、見せて頂いた本日のおすすめ食材からアスパラと飯蛸を頂きました。お造りはお刺身もとても美味しいのですが、なんといってもここの鯖寿司は美味い。酢の加減も軽く鯖の旨味がとても感じられ、鯖寿司があまり得意でない僕も追加で食べたくなるくらい美味しい。また、お刺身も醤油以外に肝醤油・梅煎酒も提供されるので、同じ白身でも違った味わいで楽しめる。続いてお勧め食材のアスパラと飯蛸。飯蛸のタコの旨味と卵のプチプチ感が日本酒を欲していたので、ここで日本酒にチェンジ。ついでにアテとしてだし巻きとからすみ餅を追加でお願いしました。〆のご飯は土鍋ご飯から前回食べて美味しかった赤貝をお願いしました。普段は貝類をあまり食べないですが、この赤貝ご飯は美味しです。少し残ったご飯はお土産におにぎりにして頂いて、夜食に頂きます。今回もごちそうさまでした。,40代前半・男性・東京都
257,00000013,むろまち 加地,3.85,東京都内,142,The Tabelog Award 2019 Bronzeを受賞された「むろまち加地」さんに伺いました。「五条駅」から徒歩６分程で到着しました。緑の千鳥の暖簾が目印の入りやすい外観です。店内に入ると大きな白木のカウンターが目に入ります。そこに椅子が８席、広めに場所はとられています。テーブル席もありました。今回は〇お通し八寸内容は　大根絹田巻き・ハムカツ・鯖の棒寿司・大徳寺麩とせり・海老の茶碗蒸し・芽キャベツマスカルポーネ雲丹のせ　でした。〇お造り三種と鯖寿司と白魚お造りの内容は　鯛、平目、たいらぎかい〇大人のポテトサラダ〇かにぱん〇自家製からすみ餅をいただきました。印象に残っているのは『海老の茶わん蒸し』海老の風味が濃厚なのに塩味もキツクなく食べやすかった。『鯖寿司』これは美味しかった。３日程醤油で漬け込んだものを使っているのですが、大きい鯖だが繊細な味わいにネタとシャリの間の山葵もアクセントになってました。『大人のポテトサラダ』中身は気分で変わるそうです。私が食べた日は「焼いた葱・鯛の酒盗・とびこ」を使っていて確かに大人な味わいでした。全体的に綺麗な盛り付け・酒のアテとなる内容・ゆったりした雰囲気で居心地のよい一時を楽しむことができました。,
258,00000013,むろまち 加地,3.85,東京都内,142,"寒風吹き荒む、冬の京都。2月頭の夜、仕事帰りに伺いました。四条駅と五条駅の間辺り、住宅街のマンション1階の暖簾が目印。ぐるっと仕切りを回ると、アットホームなカウンターが10席弱。外からは中が見えない作りになっています。鮨屋や料亭のような高級感こそありませんが、居心地のいい、楽しい夜を予感させる、そんな雰囲気です。満を辞して着座。【飲物】日本酒は10種ほど、京都の地酒を中心とした取り揃え。その他、ビールや梅酒はオーソドックスな内容です。・さわもと 純米 京都・そうくう 特別純米 京都【肴・食事】まずその日の仕入れを、木箱に入った状態でプレゼン下さいました。煮蛸や特大帆立など、見るからに良質な魚介が並びます。メニューは、酒肴やご飯物など総勢30種ほど。肉系のメニューは少なく、魚は調理方法を変えて、さまざまに提案して下さいます。・御通し八寸   (小さな木箱に美しく、京都らしい盛り合わせで。)・大人のポテサラ   (少なめのポーション、やや物足りず。)・あん肝   (柔らかめに炊いて。)・雲子の天ぷら   (すだちを絞って、クリーミーが天下布武。)・鯖寿司   (分厚く脂がのった鯖に、茎わさびがアクセント。本能的に2貫目をオーダー。)・ぐじ塩焼き   (品書き上は3,000円でしたが、お会計から察するに、大きさに合わせて調整あり。文句なしの火入れ。)・かにぱん   (食パンに蟹ほぐし身、卵白らしきクリーミーなソースを乗せて焼く。此方の名物であり、発想の勝利。)【会計】飲んで食べて、お勘定を見てビックリ。総計7,500円也。満足感に対して、申し訳なくなる程リーズナブル。高評価は、このコスパ所以か。【総評】くつろいで、酒と肴を楽しむには絶好。この日は大将のラグビー仲間がご一緒で、単騎の若造と、最後までお付き合い下さり楽しい夜になりました。一期一会とはまさに。特筆すべき点はないが、全てにおいて合格点という、総合力の高い居酒屋です。再訪必至。",岡山県
259,00000013,むろまち 加地,3.85,東京都内,142,"コメダ珈琲烏丸五条店で時間を潰す事、約１時間ｗｗようやく１巡目の客が帰りそうだとの連絡がありました。やはり居酒屋とか割烹の場合はラーメン屋みたいな訳にはいかなくて２時間はかかるみたいやね(;´∀｀)相当、待ちくたびれましたがこれでようやく待望の夜のメインのお店「むろまち加地」に入店です♪外観もそうですが店内もなんか格式の高そうな名店の香りがプンプンです( *´艸｀)広くてキレイに磨かれたカウンター席に着きとりあえずのカンペーです♪(* ￣▽)o□☆□o(▽￣ *) ♪最初は赤星から(^_-)-☆卓上にある、お箸の上に被さってる布巾はお持ち帰りOKとの事♡加地さんのロゴ入りやしこれは末代までの家宝にしたいと思います＼(^o^)／アテの第一弾は、予約限定のお通し八寸てのをいただきます(*^▽^*)これを楽しみでここを訪れる方も多いのだとか(*´▽｀*)内容は…★サワラの唐揚げ　酒粕餡かけ★ほうれん草海苔和え　イクラ乗せ★大蕪のクラゲ茄子ソース★蒸し鶏出汁巻き★板わさととびこ★湯葉と壬生菜と明太子もうこんなん出された日にゃ嫌でも酒にチェンジやっちゅうて(≧▽≦)ｂ(笑)大信州ってお酒をいただきました。再び相方とカンペー(* ￣▽)o□☆□o(▽￣ *) ♪もうどれもこれも酒を加速させるアテばっかりで本能のままに飲んでたらお家に帰れないレベルの奴ですわｗｗ酒粕の餡で食うサワラの唐揚げも大概な美味しさやったけどサッパリとした茄子ソースでいただく大蕪もほんまに良かったわ～(*´▽｀*)とびこやら明太子やらイクラやらまさしく痛風八寸やな(笑)⇧酒呑みの最上級の褒め言葉です( *´艸｀)続いてはお造りと酒肴の５種盛りをいただきましょうね♪ソレ+この日は良いタイラギ貝があるって事なので追加してもらったよ♪★鯖寿司★鯛昆布〆★河豚ぶつ★天然ブリ★菜の花★蕪素麺の塩辛ジュレ★追加のタイラギ貝の炙り追加のタイラギ貝入れて全部で７品あるって事は１品サービスやね＼(^o^)／お造りは肝醤油、梅酢、醤油の３種類が用意されてて好みに応じてとの事です。これまたすっげえラインナップですね＼(◎o◎)／！居酒屋の領域を遥かに超えてますヾ(≧▽≦)ﾉこんなん酒も必殺の田酒にチェンジせなやってられへんで(; ･`д･´)！！！と逆ギレしそうなくらい感動しましたＶ(○⌒∇⌒○) ﾙﾝﾙﾝこのアテで田酒を２杯、瞬殺ですわ(￣ー￣)ｖこの中では特に鯖寿司が飛びぬけて美味しかったです♪韓国の済州島沖の鯖を使用との事。これを３，４日醤油漬けにしてシャリとの間には刻み山葵が入ってます。おそらく今までいただいた鯖寿司の中では断トツでナンバーワンですわ♡さか井の女将、ソーリーやで( TДT)ｺﾞﾒﾝﾖｰ(笑)これは相方ともアイコンタクトだけで即決で追加注文です(≧▽≦)ｂここはもう何を頼んでも間違いない事が確認されたので他のアテもバンバン頼んでいきましょう♪★金山寺味噌これは定番の酒アテですなぁ。相方はおかわりしてましたｗｗ★だし巻きふっくらジューシーな京だし巻き♪上に乗ったおろしには高菜が混ぜられてます！★大人のポテサラ中に数の子が混ぜられた酒呑みによる、酒呑みの為のポテサラです(笑)★河豚皮湯引き結構、大きめにカットされてるので食感が凄い！ポン酢のジュレも酸味が強めでサッパリといただけました。★鯛酒盗( ´,_ゝ`)ﾌﾟｯ…こんなん酒おかわりに決まっとるがな！上喜元持ってこいやぁゴルァヾ(｡｀Д´｡)ﾉｗｗ★海老芋の唐揚げ俺的には京都と言えば真っ先に思い浮かぶのが海老芋だったりします(#^.^#)おでんのも旨いけど、もう唐揚げにしたら間違いない旨さです♪もう口の中でトロけて大変やぁヾ(≧▽≦)ﾉ★カニパンカニパンはお店でおそらく一番若手の子が調理担当です。最初はちょっと不安げに見てましたが、見事な焼き加減で若いからってだけで侮ったことを深くお詫び申し上げますm(_牛_)m料理の説明も丁寧にしてくれて、生地にはふんわり感を出すのにマヨネーズにメレンゲを挟んでるそうです。それに蟹の身をたっぷりぶち込んで低温で十数分間、表面を焼き過ぎないようにアルミを敷いて中までしっかり火が通るように焼き上げてます。これも相当美味しかったで＼(*T▽T*)／これを調理した若い子、いずれは独立してマシュマロマンの星取りそう(´艸｀*)酒ももう１杯、刈穂ってやつをいただいてそろそろ〆のご飯でも頂こうかな♪何種類かある土鍋ご飯の中から「とりとねぎ」の炊き込みご飯をセレクトです。ネギは皮を炙って鶏は低温でじっくりと焼き上げてから土鍋にぶち込む！するとご飯にネギと鶏の旨味がこれでもかぁってくらい移って…(*´Д｀)はぁはぁ♡…ウチ、ウチもうあか～ん♡⇐最近ハマってますｗｗ色とりどりの漬物をバリボリいわしながらあっという間に完食です♪しかし昼中から祇園のもりわきさんで結構な量のランチをいただいてそこからまだ「たつみ」とか「マルシン飯店」で濃い～やつを食いまくり挙句の果てにパティスリーエスで食前スイーツまでいただいてからまだこれだけ腹に入るか？と我ながら恐怖を覚えるくらいの食欲でしたわﾍ(´ω`)ゞｲﾔｧこれだけの満足感で一人頭で８０００円ちょっとでした＼(◎o◎)／！こんなん他の居酒屋が可哀相すぎるで( ﾉД`)ｼｸｼｸ…確か去年の夏前まではこの「むろまち加地」さんは居酒屋のジャンルに入ってなかったのに誰かが店舗情報を更新したのか知らん間に居酒屋になってますね。たしかにコスパ的にはちょっと高級な居酒屋でしょうが素材や手間暇を考えるとここまで良心的なコスパの居酒屋ってそうそうありませんわ！去年に同じ京都のなな治さんを訪れた時は加地さんがまだ居酒屋のジャンルではなかったので実質、関西ナンバーワン居酒屋はなな治さんでした。でも今はちょっとの差で加地さんがトップに躍り出てますが、俺的にはどちらも大好きなお店なのでこれからも京都の居酒屋を率先すべく切磋琢磨して頑張ってほしいですねd(@^∇ﾟ)/ﾌｧｲﾄｯ♪また絶対に再訪したいと思います！ごちそうさまでしたm(_牛_)m",男性・大阪府
260,00000014,石臼挽き手打 蕎楽亭,3.84,東京都内,742,東京メトロ有楽町線・南北線飯田橋駅から徒歩5分。B3出口から地上に出て神楽坂を150ｍ程上り、LucyRoseという洋品屋の先の路地（見番横丁）を左に。道なりに100ｍ程進んだ右手に店がある。こちらはミシュラン東京で一つ星を長らく獲得している蕎麦の名店。食べログ百名店のそばカテゴリにも選出されている。1998年市ヶ谷の牛込中央通り沿いで創業して2005年に神楽坂寄りのこちらへ移転してきた。店主の方は神保町の「松翁」出身。都内有数の蕎麦の名店ではあるのだが、実はうどんと冷や麦も非常に評判が高い。それならば、蕎麦とうどんと冷や麦を一度に食べてみてどれがいちばん美味しいか較べてみよう！と思い立ち伺うことにした。蕎麦は2種とも頂いているのだが、うどん・冷や麦はまだ未経験。手打ち蕎麦の名店でうどんを扱っていること自体珍しい。13:45頃訪問。店内はほぼ満席。ちょうどカウンター席に空きができ、殆ど待たずに女性店員さんが席へ案内してくれた。お品書きを見ながら、どうやって4種類を頼むのか考えてみる。それぞれ1人前ずつ頼むと確実に食べ切れない。いくつかある盛り合わせを組み合わせて2人前で納めよう。盛り合わせは二色そばが並そばと十割そば、めおともりが並そばとうどん、むぎめおとが並そばと冷や麦。めおともりとむぎめおとの並そばは100円プラスで十割そばに変更でできたはず。念のため、女性店員さんに十割そばへの変更ができることを確認して、むぎめめおととめおともりを1つずつ注文。そして十割そばへの変更をむぎめおとでお願いした。これで4種コンプリート盛り（？）が完成。女性店員さんからどちらを先に出すか訊かれたので、お任せすると答える。ランチの蕎麦屋で2000円オーバーというと随分な値段になってしまったが、まあ致し方ない。店内を見ると、ランチタイムに関わらずアルコールを召し上がっているお客さんが半数ぐらい。殆どの方が天そば（たぶんランチ限定の品）を食べている。カウンター内厨房には店主の方を含めて男性3名と女性1名（フロアも兼務）。この女性店員さんは東アジア系の方かしら？フロアに女性1名の布陣。まず注文後3分程で蕎麦猪口と薬味が用意される。猪口が4つ、徳利と薬味皿が2つずつ。うどんのもり汁は最初から猪口に入って提供される。この時点でもり汁を確認する。蕎麦用は多少辛口の返しの旨味と節系の風味が良く効いたバランスタイプのもの。うどん・冷や麦用は返しが薄口の鰹節の風味の強い出汁感で食べさせるタイプ。薬味はさらしねぎ、生山葵、おろし生姜、大根おろし。7分程で、先にむぎめおとが提供される。笊の上に手前に十割そば、奥に冷や麦が畳まれて盛り付けられている。めおともりも合わせて写真を撮りたかったが、そんなことをしていると蕎麦がダレてしまうので、さっそく頂くことに。十割そばは玄そばの挽きぐるみなのでとても香りが強く、啜ると鼻孔の奥に香ばしさが拡がる。そして嚙むと口の中に濃い蕎麦の味が拡がる。啜り心地も良く、非常に美味しい。そして、冷や麦。といっても、一般的な冷や麦とはちょっと違う。関東近県の小麦を専用石臼で製粉して使用しているので、色は薄い琥珀色で表面に粉の粒と若干の麬が見える。太さは蕎麦と当程度の細切り。「小麦粉のみで打った蕎麦」という意味不明の表現になってしまうが、それがいちばんしっくり来る。啜って見ると口当たりがとても滑らか。嚙むごとに小麦の香りと旨味が口に拡がる。いや、評判に違わない美味しさ。十割そばを半分程食べたところで、めおともりが提供される。笊の上に手前に並そば、奥にうどんが畳まれて盛り付けられている。並そばを十割そばと較べて食べてみる。十割そば程香りが強くないが、逆に蕎麦の甘みを感じることが出来る。そして口当たりは冷や麦には劣るがとても滑らか。蕎麦の香りよりも旨味を重視する方には並そばのほうが良いかもしれない。普段何気なく食べている並そばも、較べることで改めてその美味しさを知ることが出来た。そして最後にうどん。これは軽い衝撃を受けた。これまで食べたうどんとは全く違う。こちらも冷や麦同様専用石臼で挽いた粉を使っているため、琥珀色で麺肌に小麦の粒と麬が見える。太さは冷や麦の2.5倍ぐらい。どちらかというと細切りだ。啜ってみると、跳ねるようなコシの強さ。嚙むとキシっとした歯応えの弾力。そして粗めの粉が解けると、口の中でぶわっと小麦の香りと味が拡がる。いや、これは堪らなく美味しい。粉の粗さや硬さを人によっては拒絶するかもしれないが、これほど小麦を強く感じる麵は食べたことがない。その点において素晴らしいと思う。全てを食べ切ったところで、鉄瓶に入った蕎麦湯が提供される。うどんのもり汁でも試してみたが、若干塩気が立つような。蕎麦のもり汁と合わせたほうが口に合った。今回4種類全てを試してそれぞれ美味しかったのだが、このうどんを体験できたのがいちばんの収穫。冷や麦も美味しいけど、うどんの方が勝る。蕎麦は十割のほうが並そばより好みだが、並そばの美味しさも理解できた。盛り合わせで食べるならむぎめおとを十割で、単独で食べるならうどんがいちばんという結論に。うどんは強すぎて蕎麦と合わせるとバランスが悪いような気が。一度に4種食べるとか、ちょっと馬鹿げているじゃないかしら？と思っていたのだが、実際にしてみると色々と学ぶところがあってとても有益な経験だったと思う。次回訪問時には、この強いうどんを温かいメニューで食べてみたいと思う。こちらで人気のカレーが合いそうな気がしているのだが。今から楽しみ。,
261,00000014,石臼挽き手打 蕎楽亭,3.84,東京都内,742,天ぷらの美味しさにビックリ  Instagram (bottan222)ーーーーーーーーーーーーー2020/10　”歯車” を出て何処で食事をしようか考えていたら自然に此方に足が向いてしまいました、やはり蕎麦前を頂きながらお酒を飲むのが愉しいですもんね。中に入りますと長谷川さんの顔がありません、聞くと今日は天ぷら屋さんだそうです、そういえば最近、”天ぷら 蕎楽亭” さんに伺っておりませんね、今度、また行きましょう。まずは私は 「竹鶴ピュアモルトのダブルのハイボール」 で乾杯です、今日、頂きましたのは次の通りです。「お通し」・・・・・昆布の佃煮「新イカの刺身」「昆布森の生牡蠣」「新銀杏の素揚げ」「穴子の肝の佃煮」「飛露喜　特別純米」・・・・・次の ”このこ” にはやはり日本酒が良いですね。「このこ」「若鮎の天ぷら」「玉蜀黍の天ぷら」「竹鶴ピュアモルトのダブルのハイボール」「才巻海老の天ぷら」「才巻海老の頭の天ぷら」「小玉葱の天ぷら」「新烏賊の下足の天ぷら」「万願寺唐辛子の天ぷら」「新烏賊の天ぷら」「蓮根の天ぷら」　蕎麦好きの私は、今日もお蕎麦やうどんに辿り着きませんでした、メニューを見ると、蕎楽亭さんはどれを頼んでも裏切られませんので、これも食べたい、これも食べたいとつい頼み過ぎちゃいます、次回は必ずお蕎麦を食べましょう。,男性・東京都
262,00000014,石臼挽き手打 蕎楽亭,3.84,東京都内,742,ミシュランのピムグルマンにも選ばれた日本を代表する蕎麦名店です。予約は１日３組のみなので、予約は困難です。なので、ならばないと入れません。開店一巡目に行きたかったら30分前にはならんだ方が良いです。今回は土曜日の夕方にチャレンジしましたが、１５分前だったので二巡目になりました。近くのバーで休憩して、18：40ごろにやっと入れました。蕎楽亭は、蕎麦屋ですが、居酒屋的な利用がメインです。蕎麦はシメに食べる流れが基本形のようです。●味噌キュウリ　スーパーのキュウリとは違い大きくてみずみずしいきゅうり。　切り方が絶妙。お味噌もからまる。これは絶品●お豆腐　うーんウマイ。これはなかなかのもの。どこかから仕入れたものらしですがゲキウマ。しかもお安い。●こづゆ会津若松のお料理。豆に味がしみておいしい。●会津地鶏の塩焼き　地鶏ならではの歯ごたえと味の深さ。日本の地鳥っておいしいね。●煮ゆば玉子とじ　ゆばを卵とじにしています。だしがきいていて美味しい。ゆばの歯ごたえとタマゴのふわっと感がたまらない。和食のすばらしさを感じます。●蕎麦　お蕎麦が二種はいっているものにしました。　美味しい。あじわい深く、なぜか新鮮な感じ。　これはお蕎麦のかなりイイヤツだって誰もが感じるはずです。　日本人に生まれて、蕎麦のアレルギーもなく、このお店にいくことが可能なら、死ぬまでにぜひ一度食べてほしい逸品です。●日本酒　央などレアでおいしい日本酒をいただきました。　いくらでもいけそうですが、ほどほどにしています。これまで、数回きていますが、やはり蕎楽亭は素晴らしいです。味も雰囲気もサービス素晴らしい。お値段もたらふくたべて５０００円ほど、信じられないです。日本人なら、死ぬまでに一度はいくべきお店だと思います。スーパーおすすめします！！,40代後半・男性・東京都
263,00000014,石臼挽き手打 蕎楽亭,3.84,東京都内,742,朝起きたらそばが食べたい気分だったんだ。そんな時あるよね。ね？天気も良いし自転車飛ばして行こうぜ。っていうテンション。一巡目で入りたかったから開店30分前に到着。そしたらお店の人が出てきてくれて名前を伝えると「開店時間までにお戻りください」名前を伝えて受付したらある程度自由に動けるのか。有難い。開店時間になって無事一巡目入店。蕎麦も天ぷらも美味しいと評判だったから穴子天ざる・ひやむぎを注文。ざるに盛られた艶やかかなひやむぎ。美しい。そのままで食べたら納得。箸止まらなくなるやつじゃないか。柔らかい食感でコシも弾力もある旨味もある。つゆ無しでも完食できると思う。その最高のひやむぎを塩・つゆ・天ぷらといろんなパターンで食べる幸せ。甘くもキレのあるつゆもまた逸品で。なんだかんだでつゆにひやむぎをつけて食べるのが一番だね。もう一皿食べたいくらいだった。天ぷらもお蕎麦屋さんらしい気持ちちょっと厚めの衣も包まれた穴子と野菜・舞茸が美味。カラッと空気を含んだ軽い食感が凄かった。常に大人数捌きながらこのレベルの天ぷらを作り上げるのか。さらに本気の天ぷらだとどんな風になるのか気になる。今度は江戸前みたいに日本酒呑みながらおつまみも沢山食べに来よう。,20代前半・女性・東京都
