,store_id,store_name,score,ward,review_cnt,review,user_info
541,00000028,宇ち多゛,3.78,東京都内,530,もつ焼き店としては日本一な知名度の京成立石「宇ち多゛（うちだ）」。お店でも使用しているタカラ焼酎からは「宇ち多゛監修」のうめ割り風ハイボールも発売中です。先日数年ぶりに訪れて感動したので再度訪問。今回は平日15時過ぎの到着でしたが、なんと30人ほど並んでいます。後ろに並んでいた年配の常連さんの話を聞くに、数年前はこの時間で10人くらいだったとのこと。しかしここは団欒する店ではないので回転は早く、1時間ほどで席に着けました。今回は煮込み鍋真前のレアな席。マスター（二代目）が常駐している場所で、まずは「ビール大瓶」600円を注文します。「タン生赤いところお酢」200円「生」と言ってもボイルしたタンで、タンは串では無く焼きもありません。ボイルとは言えモッチリとした食感は素晴らしいの一言。人気メニューで売り切れも早く、この日は16時過ぎに売り切れていました。「ボイルのレバとハツ一本ずつお酢」200円宇ち多゛の串は2本200円固定ですが、ナマ（ボイル）のみ1本ずつが可能。1人客にはありがたいシステムです。赤みが残ったレアなハツはサクサクで刺しの様。レバはちゃんと火が通っていますが、それでもしっとりジューシーです。「ボイルのテッポウとナンコツ一本ずつお酢」200円基本ナマが好きなので続いてこちら。シコシコとしたテッポウはクセなく美味。ナンコツもパリパリな食感で旨いです。「カシラ素焼きお酢」200円1本100円とは思えない大ぶりなカシラです。ネットリとしててジューシーで素晴らしい。脂身は少なく、モチモチなカシラ堪能できます。「おしんこショウガ乗っけてお酢」200円大根とキュウリの漬物に紅生姜、お酢。サッパリとしてツマミに最適です、この日は「うめ割り」200円を3杯飲んで2200円。ビールを飲まなければ余裕でセンベロできます。やはりここのモツの質とCPは素晴らしい。慣れるとサバサバとした接客も心地よく、1人客が多いので静かで落ち着けます。料理はすぐ出てくるので、サクッと飲んでサクッと食べるのが良し。ダラっとしてない雰囲気も1人客にはとても良く、最高の酒場だと思います。,50代前半・男性
542,00000028,宇ち多゛,3.78,東京都内,530,複雑な符号飛び交い、一種殺気立つ古の空間で喰らう豚の臓物の圧倒的な旨さと、コストパフォーマンスという言葉が陳腐に感じられる驚きの勘定の瞬間。酒場好き、臓物好きで知らぬ者はいない言わずと知れた名店は、他を圧する魅力に溢れている。平日の15:30、凡そ20名の待ちで45分後に入店。歴史の堆積が迫る仄暗い空間には、近所の常連に加え、各地から集う酒場好きや、こんな所に来たことないだろう、とばかりに若い彼女を連れた自慢気な男等がひしめいている。皆一様に満足そうに、ただひたすらに臓物を喰らい、梅割りで流し込む。回転寿司の如く皿は重ねられ、串は手元に並べられて箸置き代わりになる。新鮮な臓物を見事な焼き加減で捌く黒眼鏡の女性、オーナー以下キャラクターの立ったスタッフ揃いの、客に不快な思いをさせる寸前の差配。その接客を半ば楽しみつつ食す料理は、やはり絶品である。特にカシラは特筆すべきで、一級のフレンチで供されような気高ささえ纏った旨さを感じる。品があり料理が映える皿をさりげなく使っている。そんなところも旨さを倍加させる。昔から、近所の野球帽を被ったオッチャン達に愛され、いつの日からか行列の絶えない有名店になり、老いたオッチャン達は小さくなりながらも、変わらぬ臓物の美味しさを楽しむ。そんな立石の至宝に、定期的に足を運ぶ人々がいる。,
543,00000028,宇ち多゛,3.78,東京都内,530,本日のウオーキングは京成立石方面へ。スポーツジムがお休みですので、いつもより早く居酒屋一人旅の開始です。京成立石「宇ち多゛」さんは行列なしですが、満席。少しだけ待ってテーブル席へ。梅割りと煮込み、お新香をお願いします。お新香は大根だけ。時間が遅いですからね。紅ショウガありでお酢なしでいただきます。煮込みの安定感。グループ客が騒がない酒場の雰囲気。これが楽しみで少々密な「宇ち多゛」さんをたまにですが通っております。梅割りを作ってくれるバーテンダーさんに聞かれました。「焼酎ハイボール呑んだか？」呑んだといえば良かったですが、正直者かつ小心者なんですよね。「ま、ま、まだです」と答えてしまいました。自宅にキンミヤですが甲類がありますし、天羽の梅も炭酸もありますからね。缶チューハイを買う理由がないのですが、そんなことは言えません。「こ、こ、ここで呑むのが美味しいんです」良い言い訳が出来ました。これでできんは回避です。そのあとでブドウを頼んでしまうところが、まだ甘いのですよね。実はブドウのほうが好きなのです。ウーロン茶を飲んでクールダウンしましょう。水分補給は大切です。最後にシロをたれ焼きでお願いします。デザート感覚で美味しいのですよね。（タカラさんのHPより）今回発売する＜立石宇ち多゛のうめ割り風＞は、東京都葛飾区立石にある有名店『宇ち多゛』店主が監修したフレーバーです。同店は、大衆酒場ファンの聖地とも呼ばれ、宝焼酎ベースの「うめ割り」ともつ焼き・もつ煮込みが名物です。今回、同店人気の「うめ割り」を焼酎ハイボールらしい辛口の味わいに仕上げました。パッケージは、ベースカラーに『宇ち多゛』の暖簾をイメージした黒エンジを用い、裏面で店舗をイメージしたイラストと同店の説明を掲載することで、その世界観を表現しています。なお当商品の収益の一部は、『宇ち多゛』店主により、葛飾区の子供食堂に寄付されます。子供食堂への寄付ができるなら、今度缶も買ってみたいですね。どうもごちそうさまでした！「宇ち多゛（うちだ）」東京都葛飾区立石1-18-8仲見世商店街[月〜金]14:00頃～19:30頃(L.O)ただし売切れ仕舞い[土]10:30頃～14:00頃(L.O)ただし売切れ仕舞い日祝休,40代後半・男性・東京都
544,00000028,宇ち多゛,3.78,東京都内,530,まだ通算30回台訪問のひよっこですお店に入ると「いやらしい性格」まずはお店の方を観察ポジションが決まっていてコンビネーションが素晴らしい大昔はどっちからも入れて行列も絶妙な采配で分け隔てなく同じように進んでた煙草も吸えて灰皿は床に　おが屑撒いて吸い殻を片付けててたのかな　大昔のパリの大衆ワイン食堂だ（行ったことあるわけないじゃん）入り口側に着席「兄貴、わるいなぁ、移ってくれるか」兄貴という軽やかな響きが心地よく、気持ち良く移りました念願の「煮込みかぶり席」じゃん　いちど座りたかったんだよなぁ　なんてラッキーこのエリアはソフトな物腰、店主様のエリア優しい雰囲気が心地よいまたこちら側はツンデレの縦横無尽ファンタジスタ一見怖そで優しい若旦那のエリアご常連さんに　うるせぇ、黙れ　って云ったのが面白く　ご常連さんもニヤニヤしてた昨今あんまり大きな声で喋れない時代ですから出てくるお品はみな満足それにしても　お客さん　好みがバラバラのカオス状態これじゃ世の中纏まるわけないなそれにしてもお客人の身勝手なお好みに何食わぬ顔してアジャストするプロ魂には感動する注文の魔法みたいな符牒聞いてるだけでも面白い土曜日　めちゃめゃ　行きたくなったぞ行列してても　そろそろ暑くなくなってきたし生（茹でてある）のお酢系が好みだなよく焼きはあんまり頼まないあぁ、レバ　ナマの時代が懐かしいレバは若焼きさえコンプラに反するからNGですレバ　うんと若焼き　タレ　食べたいなレバ　ほとんど焼かないで　タレ　食べたいな　出来レバ　のお願いです,
545,00000028,宇ち多゛,3.78,東京都内,530,とにかくもつが旨く、一見怖そうなスタッフがメチャクチャやさしい✨✨私の中では、レジェンド‼️,40代前半・男性・神奈川県
546,00000028,宇ち多゛,3.78,東京都内,530,ようやく憧れの宇ち多さんに来れました。色々勉強してからの宇ち入り！開店二時間前に着きましたがまだ誰も並んでませんでしたのでとりあえず散歩して時間を潰し一時間前になりましたので再度来てみたら10人ほど並んでましたから後に続きました。初めてでしたのでどこにならんでよいかわかりませんでしたのであえて列のうしろにしました。とりあえず待ってる間にスタッフさんが入り方を指示してくれたり飲み物を聞いてくれたりでホッとしましたね14時になり続々とお店に入りすでに注文を皆さんしており予想通り出遅れた(笑)しかし負けてたまるかと注文を(内緒ですが今回食べたいのメモをしててそれを見て注文)意外とすんなりできて緊張がほぐれました。梅割りは予想以上に効くこれは酔うぞ(笑)ゆっくりゆっくり飲むことにしましたね！今回三人で来ましたのでもつやきを注文をするときは計算しながらの注文。どれもこれも旨すぎ特にタン生赤い所なんかは絶品！シロ生、レバボイルは今まで食べたときないくらい美味しかったぁ～コスパも素晴らしく遠慮なく頼めるとこも良いですね！珍しい部位は今回初めてでしたので最初から諦めてましたが次回来るときは頼んだみたいと思います。いやー、これが噂の宇ち多さん最高過ぎます全部美味しくてこれはまた必ず来たいと思いましたねどうも御馳走様でしたまた宜しくお願いします,男性・東京都
547,00000028,宇ち多゛,3.78,東京都内,530,土曜日に伺いました。11時に到着。並びがなかったので、直ぐに案内されました。いつものぎゅうぎゅうで座るスタイルはありません。入り口には消毒液。ちゃんと消毒してから入店します。葡萄甘め＋サイダー(グラスなし)を注文。(２杯と半分)因みに師匠は梅５杯と半分↑これ絶対に後で、寝ちゃう量┐('～`;)┌・煮込み黒い所フワが沢山入っていてうれしい～(^^)・レバー素焼き お酢・シロ素焼き 味噌・シロ良く焼き タレ・お新香しょうがのせて酢(今回はきゅうりがあったー♪)(その他色々と注文しましたが、画像失念)以前こちらでお会いした方達と同席となり楽しい時間を過ごせました。やっぱり、いい酒場です。心残りはかしらが売り切れだったこと,50代前半・女性・東京都
548,00000028,宇ち多゛,3.78,東京都内,530,ネットで自粛要請明けの営業を開始したとの未確認情報を得て半信半疑で行ったら、いました長い行列が・・・(@_@)表はもういっぱいだと思い裏に回ると裏だけでも２５人ほど並んでます(>_<)まぁ人気店なのでしょうがないですね。そんなわけでおよそ１時間ほど待ってから入店。まずは梅割り２００円。これは寶焼酎の焼酎ストレートに梅シロップを垂らしたもの。アルコール度数が高いのでかなり効きます。つまみはレバー２００円、カシラ２００円、タン生２００円を全部塩味で普通。レバーは若焼きがなくて、タンは生という名のボイルになります。やっぱりレバーは若焼きがいいなぁ。カシラは肉のうま味と炭火の香りがいい感じにマッチしてます。やっぱカシラは外せません。次いでぶどう割り２００円とハツ２００円、シロ２００円、ナンコツ２００円を全部味噌で普通。ぶどう割りは梅割りのぶどうバージョンですが、これもちょこっと垂らす程度でそこまで味は感じない。シロはよく焼きで注文する人が多かったですね。ハツは柔らかめの食感でよかった(^^)ナンコツは味噌よりも塩の方がよかったかも。締めて１６００円。もつ焼きは１本１本のボリュームがあるし、２本縛りなので１人だと全部制覇するのはキツいかと思われます(^^;)しかしこれだけ飲み食いしてこの値段は素晴らしい。私が入店した後は１０人くらいで行列はなくなってました。なので、その後来た人は待たずに入れましたね。そんなことは今だけだろうなぁ。しばらくするとまた閉店まで長い行列になると思われます。個人的に東京のもつ焼きはコスパの宇ち多゛ 、味の秋元系列という感想ですね(^^),40代後半・男性
549,00000028,宇ち多゛,3.78,東京都内,530,『宇ち多゛』依存症で再訪。はるばる立石に上陸。店前で並びながらオーダールールを復習する。ちゃちゃっと並んで運よく、ささっと入店。店先で2人組の夫婦が2席空くまで入店を拒んでいて、回してくっ付けて貰えることを伝えたものの頑として動かない。結果として私が先に入店させて頂くことになった。前回は完全に店の雰囲気にのまれていたが、2度目となると少し余裕がある。さてさて、「飲み物は？」と内田3代目。「梅」と返す。「タンナマあります？」と聞く。「終わっちゃった」「ではハツナマを。。」2度目で生意気に梅割りを「梅」と注文してみた。笑梅割りは、宝焼酎をレトログラスに勢いよく注ぐ。もっきりスタイルで受け皿に零れる。梅エキスを遠めからぴゅぴゅっと垂らす。梅エキスが以前より少なく、ほぼ焼酎のキに近い。以前はアルコール度数が強すぎると思っていたが、もつには梅割りが合うと感じるように変わった。よく焼のコゲと合う。前回の重苦しい「もつ品評会」の雰囲気と異なり、今回はみなさん雑談をされて、雰囲気もやや違うように感じる。ハツナマは新鮮で食感がよい。ハツナマを梅で流す。次の呪文を考えながら、もつを食べる。・シロヨクヤキタレ　シロはよく焼いた方が食感的に硬さが増して丁度よい。・アブラヨクヤキタレ　アブラも食感もよいが、脂を落としてヘルシーになってうまい。・カシラタレ　カシラは肉肉しく美味しい。　タレが続くと胃にもたれるので塩でもよかったかも。・お新香オス間違えて、「お新香お酢入れて」と妙な注文をしてしまったが、注文は通った。汗しかし、胡瓜の無い「ダイコンショウガノッケテ」が到着。隣のご常連にお聞きすると、遅めの時間帯は胡瓜が無くなるとダイコンだけ出されるとのことを教えてもらえた。ダイコンを食べて、おなかいっぱいで煮込みを頼まず。宇ち多゛も3杯までと決められている「3杯屋」であるが、最後に「半分」を注文できる。3杯飲んで「梅半分」を注文。グラスに9割入れてくれるサービス。楽しい。ごちそうさまでした。『宇ち多゛』２度目の宇ち入モツのことしか考えない時間と雰囲気悩みも忘れて、梅で酔う　至福のひと時(2020年3月食べログ評価：3.75点),
550,00000028,宇ち多゛,3.78,東京都内,530,さあそろそろ頃合いになったかなー？？時間を見計らってうちださんの様子を見てみると…………あら？１人だけ？？え？え？やってるよね？中を見るとやってる＆当然満席。これは？？もしかして？？タマタマラッキーッキーでタイミング良い感じですかーー？？？本当にその通りでウチらが並んだ直後にまたずらずらと並びが出来始めてましたね。って訳で運良くほとんど待たずに入店～♪ぎっちぎちですの。こちらは壁にメニューが掲げられてるのですがその通りに頼んでも通らないという謎仕様。暗黙の了解で裏メニューを覚えて注文しないといけないのです。二郎よりも難易度たけーな…でも何も知らない客であっても、常連さんたちが教えてくれるらしいのでそこは安心かな？個人的にはフツーにメニュー出しておいてほしいと思いますケド。とりあえず同行した常連さんに教えてもらって注文内容をメモメモ。しかしあいぽんの操作をミスって半分以上消すという愚行をしでかししどろもどろで注文～。《梅割り》　200円梅割りと言いつつもほぼほぼ焼酎。この濃さ！素晴らしい！愛してル！《たんあかいの》　@100円 × 2本200円でこのボリューム！この色！この鮮度！この美味さ！もうプルップルで旨味もぎゅーーっとあるの！！マジーーーー↺↺↺↺？？？？《にこみあぶらいれて》　200円200円でこのボリューム！甘辛い醤油味で濃いめながらも決してしょっぱくはない絶妙な味付け！ウマイ！これもうまぁあああいい！！《あぶらおおいのたれ》　@100円 × 2本こってり醤油ダレと脂！これでなんで重くないの！？ｳﾏｲﾉ！《しろたれ》　@100円 × 2本カリっとなった焦げ目とプルっとした食感のコラボが素晴らしい！そしてシロにも醤油ダレが合うんですよねぇ♪あと２品ほど食べましたけど詳細忘れた。いやしかしこちらはスゴイ！このお値段でこのクオリティはアリエナーーーイ！平日昼から大行列も納得です。今度は一人で来るかなぁ…でもやっぱちょっと敷居高いナ。,40代前半・男性・東京都
551,00000028,宇ち多゛,3.78,東京都内,530,マイレビュアーさんのハッピーバースデー祝いを船橋でやったとき。ピッツェリアでケーキに入れる名前を尋ねたら、ケーキは要らないので居酒屋に連れて行ってくださいとのリクエスト。せーので行きたい居酒屋の名前を同時に言ったら同じ店でした。いざ行ってみると、悲しいかな満席。その場で、『立石にある世界遺産居酒屋にご案内します。きっと気に入っていただけると思います。』と約束します。宇ち多゛はしろくま１１２４さんに何回か連れて行っていただき、最後が７年前でした。７０歳になったらがんばってきたジブンへのご褒美に宇ち多゛へ行こうと思っていましたのでちょうどいい。時間を約束してこの日の決行となりました。無事に会えて行列に向かいます。この日はラッキーでした。並びは前に１６人だけ。店に入って３０分も経たない頃には行列なしという奇跡の日でした。順番が来て二人客が店から出て、これもラッキー。最初から並びで座れます。来るにあたっては、もう一度しろくまさんの指南に目を通し、最後まで慌てずに食べたいものが食べれて大満足な宇ち入りとなりました。先ずはこれからですね。＊梅割りX２＊ウーロン茶マイレビュアーさんがチェイサーが欲しいと言うのでウーロン茶。コップひとつで。そして、スタートはゆるぎない煮込みで。折角なんで、ちょっとずつ変えて味わいます。①煮込み白いとこ多く②煮込みアブラ多くこれだけでも十分すぎます。居酒屋で煮込みを頼むことはまずないワタシですが、ここは全くの例外で真逆ワールド。③タン生生を２皿お願いするもひとつは飛んだようですが全く気になりません。また言えば済むことです。タン生、二人で大興奮。どうしてこんなに旨いのか不思議なくらいです。梅が空いたので＊瓶ビール大　コップ二つ二人とも、このくらいの酒があれば十分。後からジブンタチの前に座ったお客さんは、２皿と梅で帰って行きました。こういう常連になりたいなって会話して。④シロ味噌⑤カシラ塩焼物２皿いっちゃいます。楽しすぎる、旨すぎる。⑥ハツ生これが最後の皿だと言うことで、宇ち多゛の神に祝福され。⑦ダイコン生姜乗せてマイレビュアーさんもちゃんと予習していて、これは言う前に言われてしまいました。よいことです。⑧ガツ塩たまりませんねえ。ガツはよく買って来ていただきますが、旨さが違う。宇ち多゛のガツ焼きとおけ以のガツ炒めはガツ料理の最高峰。⑨レバボイルやっと食べれました。相性が悪いのか、３回目のコールでゲットでこれで帰れます。想像以上に楽しくて想像以上においしかった、というマイレビュアーさんからの言葉が最後に来て。船橋で食べれなかったのも守護神のお導きかなと。『私、もう一回ここに来ます。』でしょうね。『行列さんと一緒に。』,70代以上・千葉県
552,00000028,宇ち多゛,3.78,東京都内,530,平日の昼に２名で伺いました。以前、京成立石で千ベロツアーしたときは予習が足らずに訪問できなかったのでついに念願が叶いました。お店にはメニューもないので予習なしでは厳しいと思います。ネットで検索すれば色々出てくるので事前に記事などを読んでいたほうが良いです。（下記参照）http://dodeshow.doorblog.jp/archives/28898884.html14：00開店で15：00前に到着。店内満席で並びは10人ほど。これでも少ないほうだと思います。開店は良いので15分程待って入店できました。少し強面のホールの方に（無愛想、言葉遣いも鋭いですが根はいい人です。）1席空いたカウンター席に案内され「あれ、2人一緒に座れないの？」と不安になりましたが。2人分の席が空いた時に移動させてくれました。後述する注文方法もそうなんですけど、すっごくゴミゴミしている店内でお客の主張なんて通らない雰囲気がするのに、忘れずに席を一緒にしてくれたり、焼き方や好みの部位を多めに入れてくれたり細かい部分まで対応してくれるところがこの店の意外ですごいところだと思います。席間はほとんどなく、客同士で遠慮し合いながら自分の領域を確保するのが暗黙のルール？！まずは、「ぶどう」200円で乾杯（宝焼酎にぶどうのシロップを掛けたもの。「うめ」もある）ドリンクは大瓶が600円ですがほかは大体200円です。上限は3杯までとなっており、注がれる都度「今何杯目？」と確認されます。飲みすぎた客が大暴れして嫌な思いをした経験でもあるのでしょう。酒の量を制限しているから長いもせず回転が良いのでこの点は大賛成です。次に料理ですが、煮込み200円はまず頼むと良いと思います。（脂（の部位）多めとか赤いとこ多めとかもオーダー可）次にモツの「生」「焼き」を頼みます。「生」はボイルされてます。どちらも串に刺さっていて2本で200円！メニュー表がないので、何を頼んだらよいかわからない人は前述した予習画面をスマホで開きながらオーダーすると良いでしょう。この値段でこの量・質なら◎つけたくなりますね！最初はゴミゴミしすぎて、オーダーのタイミングもわからず戸惑っていましたが、飲んでいるうちに慣れてきてしまうのが不思議。次回また訪問したいです。ごちそうさまでした！！,30代後半
