,store_id,store_name,score,ward,review_cnt,review,user_info
0,00000001,串揚げはやし,4.11,東京都内,110,神楽坂の早稲田よりの出口から出て徒歩数分。静かなエリアにお店あります。串揚げランキングで一番上に出てくるお店なので期待して訪問(^^)低めの入り口を入ると中は四角い形のカウンター。こじんまりとした店内です。カウンターに座ると、薬味やソースの入ったお皿を渡されます。5種類以上ありました。飲み物は、ビールか日本酒が焼酎のみで、サワーとかカクテルとかは置いてないのでそこだけ注意です。ソフトドリンクもないかもなのでお水を持参してもいいかもしれません。店主は福岡出身でいかにもお酒好きそう。日本酒とかもこだわって仕入れていてそれを楽しんでもらいたいというのが伝わってきます。おまかせでコースで出てくるのですが、串揚げだけではなくてお刺身や生からすみ、チャンジャなどこだわりメニューもたくさん。これらもめっちゃお酒に合うって感じです。串揚げ自体は、お肉がメインで、牛サーロイン、牛ヒレ、豚肉、鶏肉のねぎまなどが出てきます。あとはエビやギンナン、蟹の爪など。串揚げのバリエーションがめっちゃあるというわけではなくて、お酒に合う一品料理と肉系の串揚げというイメージでした。最後の方にユッケもでてくるのですが、こちらも甘めの味付けでアテって感じです。個人的にはもうちょっといろんな串揚げを楽しみたいタイプなのですが、味自体はとても美味しかったと思います！、店主もクセあるってめっちゃ書かれていますが笑、確かに最初はクセ強いなって思ったのですが話しているうちに優しくていい人でした。,30代前半・東京都
1,00000001,串揚げはやし,4.11,東京都内,110,Instagram    pateknautilus40https://www.instagram.com/pateknautilus40/ ご覧いただき有難うございます。皆様の『いいね』『フォロー』『お店の保存』を頂けると幸いです。The Tabelog Award 2020 Bronze 受賞店の『串揚げはやし』に伺いました。こちらは食べログの串揚げ部門で、あの有名な『串かつあー ぼん』を抑えて堂々の1位です。(投稿日現在)場所は、神楽坂駅や牛込神楽坂駅より徒歩で4～5分程の所に有ります。店内には低めの入口を屈んで入ります。着席するとテーブルにはセットが置かれており、その日使うつけダレ一式が運ばれてきます。料理は串揚げばかりではなく合間に一品料理も出てきてそれらも串揚げに負けず美味しいです。串揚げも火入れが絶妙なバランスでとても美味しいです。博多出身の大将は、話していると福岡独特の喋り方なので直ぐに福岡の人だとわかりましたWWWなお大将は、特に修行経験等が無く揚げもの屋さんをやりたくて突然独立されたそうです。そういうパターンは中々ありませんよね。福岡の『とりら』の大将もサラリーマンから急に独立してたから、博多の人に多いのかもしれませんWWW火入れ抜群の料理はどれもとても美味しく頂きました。また伺います。ご馳走様でした。なお、この日頂いたものは下記のとおりです。『鈴かぼちゃの漬物』『小松菜の漬物』『大葉巻きの鱚、大葉は塩で鱚はポン酢で』『大葉巻きの車海老、身の部分と頭に分けて』『生の唐墨』『生サーモンの炙り』『生のチャンジャ胡麻和え』『蟹爪』『春菊にサーロイン巻』『サーロイン2段』『ヒレ』『豚ヒレ』『ささみと韮』『ねぎま』『ユッケ』『お麩に柚子味噌』『大根の漬物』,
2,00000001,串揚げはやし,4.11,東京都内,110,久しぶりの林くん。この日は予約間違えてたらしく珍しく他のお客さんいなくて貸し切り状態。今回はご飯ものもお願いして。馬肉ご飯めっちゃうまかったーチャンジャとご飯でも食べたけどここのチャンジャは濃厚なので白米にあうわあうわ…白米も魚沼産コシヒカリで米単体でうまい。チャンジャも久しぶりに出してくれてうまかった。・カボチャ・カクテキ・ふ・海老・カラスミ・鮭・チャンジャ・銀杏・蟹の爪・サーロイン春菊・サーロイン・チャンジャご飯・ユッケ・漬物・ヒレ・豚・ねぎま・キス・馬肉ご飯この日も結構飲んだけど前来た時ほど酔わなかったなーこの後梯子で酒飲んだけどこの日は絶好調で肝臓最強だった…ｗ美味しかったですごちそうさまでした( *´艸｀),30代前半・男性・東京都
3,00000001,串揚げはやし,4.11,東京都内,110,この日もお店は常連様方で賑わってました(^o^)飲兵衛認知されてるので一緒に行った友人より量が入るグラスで日本酒を提供してくださいました(笑)まずは酢かぼちゃと小松菜のおひたし。さっぱり。串揚げよもぎ麩上には甘めの柚子味噌海老大葉に包まってるのでその香りもするのですがタレに山椒が入っていてこれがピリッとアクセントになって旨いのよね〜(*´ｪ`*)蟹爪ぎんなん甘皮、衣付きと素揚げの2つが楽しめて楽しい♡サーロインこれはたっぷりタレを吸わせてからいただきます。中央には春菊。春菊苦手なんですが肉が旨すぎて存在忘れてた(笑)牛ヒレ同じ揚げで比べても何処の牛カツ屋よりも薄衣でレア♡毎度この肉の揚げにはビックリする。綺麗だし旨い！！豚ヒレねぎまはい、あの焼鳥のねぎまです(笑)おもろい。そして揚げにするとネギがほわっと甘い。キス揚の間にはサーモンのお刺身と大根の漬物も出ました。そしてフォトジェニックなユッケ♡♡合法なんですか？って聞きたいくらい肉厚♡笑肉の旨味はガツーンとくるけど脂はさっぱり。細切りのとろける〜ってお店よりは生肉食らってる〜って感じ。ワイルドで贅沢( ･ิω･ิ)この日は泥酔せず堪能出来ました(笑)日本酒ってお猪口のお店でも一口で行けるので飲み過ぎちゃうけどここのグラスは大きいのでグビグビ飲んでもそう減らないから飲みすぎる(笑),30代前半・女性・東京都
4,00000001,串揚げはやし,4.11,東京都内,110,店主が入院のため一時期店もお休みになってましたが、無事復活。快気祝いも兼ね訪問して来ました。クセのある接客は相変わらずですが、慣れてしまえばなんのその、お酒も回って来るとその店主との掛け合いが心地よくなってきます。そんな中でもコースで提供される串揚げは繊細そのもの、食べ方に対しても相変わらず細かい要求があるけどここでは素直にそれに従うのが結局一番美味しく食べられる方法だと思いますね。絶品の串揚げと酒飲み仕様の一品料理を肴に美味いお酒を飲んで酔って帰るのがここでのおきまり。,
