,store_id,store_name,score,ward,review_cnt,review,user_info
880,00000045,パンデュース,3.79,東京都内,641,初訪店舗の概要は標題の通りです。内、3店舗が西100名店に入る人気店のようで、全く知りませんでした...地下鉄四ツ橋線「本町駅」と「肥後橋駅」の中間の立地です。土曜日の午後にお邪魔してみました。到着1420、先待ち4名様。入店はMax5名までのようです。5分程で入店。店内、パン屋としては、広めの印象で品数も豊富です。頂いたのは、　※ 税込+食べた順① 210円：フルリル② 280円：クワトロフロマージュ③ 270円：パン ペルデュ（フレンチトースト）④ 260円：オリーブパン食した所感は、① フランボワーズの酸味が光る出来栄え。此れで込210円はお値打ちでしょう。【3.7】② ソノママ食しますとイマイチなのですが、加熱しますとゾンビの如く蘇り、4種のチーズの風味が際立ちます。【3.6】③ ラム酒+お焦げ感はイイのですが「フレンチトースト」と思って食しますと、そうでも無いような...シナモンも効かせて欲しいかな？【3.3】④ オリーブが練り込まれただけのフランスパンです。此方もソノママ食しますとイマイチなのですが、加熱して、オリーブオイル+岩塩で食しますと、劇的に風味が向上してしまいます...加熱後の上昇度は過去最高の域【3.7】平均：3.75≒3.6③ が悔やまれます...,50代前半・男性・大阪府
881,00000045,パンデュース,3.79,東京都内,641,白銀亭さんで食べ終えると、斜め向かいにはパンデュースさんの本店があるようだ。ホテルにチェックインする前に、明日の朝ご飯を買っておこう。以前、大阪駅のパンデュースさんに伺ったが、夜遅めの時間だったこともあり、あまり選択肢がなかったので、今回店内に入ると色々置いてあってちょっとテンション上がりました。特に野菜のタルティーヌが美味そう〜っ！レンコンのタルティーヌ、ネギだくのタルティーヌ、たまらん見映え。以下を購入！・レンコンとスモークチキンのタルティーヌレンコン好きにはたまらないヴィジュアル。さくさく食感、ちょっとねっとりもしつつ。スモークチキンの香りが良いです。・ネギとブルーチーズのタルティーヌこぼれ落ちんばかりのネギ！でも、意外とこぼれ落ちません笑ネギの風味、苦味がブルーチーズの酸味とベーコンの旨味でより立って美味しいです。・アマンド(写真なし)アーモンドクリームを絞って焼き上げたもの。ラム酒の風味がとても良いです。タルティーヌ、良いなぁ、うん。,男性
882,00000045,パンデュース,3.79,東京都内,641,近くに用事があったので帰りにテイクアウト。何のパンが有名なのか分からなかったですが、系列店がいくつかあって有名なパン屋さんらしいですね。今回焼きカレーパン・バニラメロンパン・チャバタサンドを購入。❇︎焼きカレーパン生地がふわふわで、中にチキンカレーが入ってました。辛さもちょうどよく食べやすかったです。個人的にはもっと具が詰まっているほうが好きですね。❇︎メロンパン普通のメロンパンよりかは薄くて小さいのですが、食べるとサクサクでメロンも風味もこっちのほうが断然良かったです。甘味もしっかりしていてとても美味しいパンでした！❇︎チャバタサンド割と生地は硬めでした。チーズ、ベーコン、レタスが入ってました。これもカレーパンと同じで、ちょっと具が少なめかなという印象。一つ一つの具材は特段なにかというわけではなかった。まぁ具材がそれぞれ相性いいのでそりゃ美味しいよねくらいの感覚。この店付近には有名なお店が多いので、また違うパンも食べてみたいなと思いました。Instagram▶︎ https://www.instagram.com/f.t_s.gourmet,20代前半・男性・大阪府
883,00000045,パンデュース,3.79,東京都内,641,人気で有名なパンのお店。朝方だったのですいてます。食べたいものいっぱいだが大人買いはやめとこう。だが美味しそうなものばかりなのでキョロキョロ。選んだのはレビューでも書いてあった気になっていた「ネギのブルーチーズのタルティーヌ」(480円)とお値段が安かったので「ドゥミ」(120円)にしました。タルティーヌは一口目はネギの香ばしさが来ます。ネギの味はするが薄いなぁと思ってたが真ん中に行くにつれチーズの味、お肉の味、ソースの味と混ざり合ってきちゃいます。なるほど美味しねー。ドゥミはバケットらしく、切り目を入れず焼いてるので柔らかいとのこと。食べるとバケット感なしでもちもちなパン。これはこれで美味しいですよ。このパンにカマンベールチーズとガーリックオイルで焼いたネギを入れてオーブンで焼いて食べました。タルティーヌ風にアレンジ。美味かった。美味しかったです。ご馳走さまでした。,男性
884,00000045,パンデュース,3.79,東京都内,641,久しぶりのパンデュースさん♫いつ食べても美味しい〜(˘͈ᵕ ˘͈♡)ஐ:*本店に来るのは久しぶり。今は淀屋橋や梅田、新大阪でも購入出来るので本当に有難いです！相変わらずお惣菜系が鮮やかでめちゃくちゃ美味しそう♡季節のお野菜何かが沢山美味しいパンと頂けるのがパンデュースさんの醍醐味なんだけど、他にも美味しいパンだらけで悩む(*≧艸≦)◎キャベツと生ハム エメンタールチーズ 350円紫キャベツがザクっとパン生地に乗せられ、チーズがたっぷりのパン。もちもちとした全粒粉の生地とパンの存在を忘れる程のキャベツのボリューム！ほとんどキャベツでヘルシーですが濃厚なチーズでしっかりした味に。キャベツ好きには良いかもね〜♫◎クロワッサン 240円平均的な大きさで発酵バターの風味が素晴らしい！しっかり焼かれている為サクサク系。ただ端の方はゴム感があり固い…こちらのクロワッサンは真ん中と焼きたては良いんだけど時間が経つと端がやたら固く、噛んだ時に生地の繊維が同じ方向だからか重なり過ぎていてゴムみたいなんですよね…誰か〜この感じ説明してほしい！（笑）◎オレンジピール食パン 1／2 350円暑いこの季節にぴったりの食パン。そのまま食べたらしっとりふわふわで、オレンジの香りがとても優しく感じます。トーストすれば今度はサクサク感が出てきて、オレンジピールが強さを増します♫めっちゃ美味しい〜(   ¯꒳¯ )ｂ✧そのままでも焼いても美味しいパンは久しぶり！◎ハートのミルクパン 120円パン職人さん達が立ち上げたプロジェクトでこちらを購入すると50円の寄付が出来るというパン。ミルクの味わいが優しく感じられ、ふわふわともっちりのバランスの取れた食感。『♡』のフォルムも素敵。何か一つでも社会貢献出来て良かった！やっぱりお惣菜系と食パンが美味しい(＊ˊ艸ˋ)♬*安定の美味しさなのでクロワッサンをもう少し改良してくれたらなぁ〜,女性・大阪府
885,00000045,パンデュース,3.79,東京都内,641,開店直後を狙い、ホテルの朝食の食後の散歩を兼ねて訪問しました。かなり控えめな外観です。先客はゼロ。◼︎ドゥミ¥120「ソフトなバケット」との説明書がありましたが、バケット感はないです。気泡のしっかり入った淡い褐色のもっちりパン。全粒粉なんでしょうか？やや酸味を感じる、超シンプルな味わい＆当店では一番コスパの良いパンです。◼︎ほうれん草と黒ゴマ、チーズのフォカッチャ¥260かなりほうれん草が入っているようですが、味にはあまり影響がなく、どちらかというとチーズの味が前面に来るパン。お惣菜として秀逸ではあるものの、いかんせん小さい（泣）◼︎クロワッサン¥240アイコン的存在。サクサク…ではなくカリッとした食感。かき揚げ餅のような後を引く感じ。ちょっと珍しいタイプかもしれません。店内、魅力的なパンがいっぱい陳列されているのですが、例えばサンドイッチが¥580などかなり強気な価格。たまのご褒美としての利用価値なのかな？美味しいですが、普段遣いにはちょっとしにくいですね。,
886,00000045,パンデュース,3.79,東京都内,641,職場の最寄り駅は本町なのに、こちらのお店に未訪問というのは由々しき事態ではないか？という思いを抱きつつ、職場とは逆方向のためなかなか行く機会がなかったので、休日の日に訪問。店内に入れるのは５名まで、という貼り紙と消毒アルコールあり。扉は閉じているが、ガラス窓から中が見える状態なので、中をしっかり確認してから入店。店内の面積の割に、パンの種類が豊富。店奥のカフェスペースは閉鎖中。様々なパン達に目移りしつつも、野菜を使ったパンが美味しいという評判を聞いていたので、ネギとブルーチーズのタルティーヌ480円（税込）とほうれん草とゴルゴンゾーラ自家製ホワイトソース350円を購入。野菜の惣菜系パンは思ったより高額だったので、２つしか買わなかった。甘い系や食事パンはそんなに高くなかったと思う。あれこれ迷ってる間に新しくお客さんがどんどん入店されて５名以上になる。店員さん、何も言ってくれないのね。密になるのも嫌だし、ゆっくり選択しているのも憚られる雰囲気なので早々退却。会計時、各パンを小袋にはいれてくれるけど、袋は有料と言われる。マイバッグはたくさん常備してるので袋は不要と断るも、袋詰めスペースがないので、お財布しまってマイバッグ出して詰めてと大慌て。帰宅していただく。ネギぎっしりだよ。ブルーチーズにベーコンまで入ってるので食べ応え十分。パン生地は引きが強いタイプだけど、メインはネギ。ほうれん草とゴルゴンゾーラも、ほうれん草がみっしり入ってて、お浸し食べてる気分。ゴルゴンゾーラとホワイトソースも美味しくて、パンはわき役。もちろんパン自体も充分美味しいのだけれど。野菜のパンは高いと感じたけど、これはパンというよりデリカテッセンなのかも。そう思うと適正価格に感じる。野菜のボリュームしっかりあるので。,女性・兵庫県
887,00000045,パンデュース,3.79,東京都内,641,最近はパンがお気に入り。手術を受けてから早くも10ヶ月、少しずつは食べられる量が増えてきたような気もするけど朝ごはんはやっぱり食パン半分しか食べられへんというのは変わらへん。その後しばらくしたら腹は減るんやけど起きてすぐは入らんということらしい。そやから朝メシはもっぱらパンであるけど、そのおかげかおやつも含めてパンを食う、パンを買う機会が多くなってきてる。サンドイッチ用のパンやったらどこのやつ、バゲットはどこがええ、クロワッサンはやっぱりあそこ、なんて普段からのおきまりのやつもあるのはあるけど、それはとても美味しいんやけど、テレビの特集なんかで見ると気になるお店が増えてしまう。てなことで気になってた店の一つ、「パンデュース」さんへ行ってみる。ちょっと小雨の中、地下鉄本町駅で降りて、御堂筋を淡路町通りまで行って左に曲がる。えらい行列が見えてきた。パン屋さんではなくカレー屋さんみたい。今日は目的地が違う。横目で見ながら前に進む。左手に瀟洒で明るいパン屋さんを発見。街角のパン屋さんというよりは都会のカフェという感じ。消毒しつつ中に入る。ここまで来てはたと思い当たった。テレビなんかで話題になったけど何が話題になったかさっぱり覚えてないのだ。けどまあパンはパン、特に覚えておかんでもどれでも美味しいに違いない。適当に買ってみよう。というてもパンって食ってみんとわからん。見た目やったらどれ見てもうまそうではないか。とりあえず見た目でいくつか買っていこう。というてもバゲットとクロワッサンはとりあえず味をみておきたい。カレーパンも興味津々。てなことでいろいろ食ってみた。とても美味しい。でも、いつものやつより断然美味しいというほどでもない。それぞれの店の特徴を気にいるかいらんかの違いなんかもしれん。もっといろいろ試してみんとあかんではないか。ご馳走さんでした。店名　「パンデュース（PAINDUCE）」ジャンル　パン、サンドイッチ住所　大阪市中央区淡路町４−３−１　FOBOSビル1F電話　06-6205-7720営業時間　[平日]8:00-19:00[土・祝]8:00-18:00定休日　日曜メニュー（表示）　日本語言語　日本語ブログランキングに参加しています。もしよかったらポチンとお願い致します。にほんブログ村ありがとうございました。,70代以上・男性・和歌山県
888,00000045,パンデュース,3.79,東京都内,641,平日10時過ぎに訪問。出張の隙間時間に来ました。8時からやってるんですね。パン屋としてポイント高い！朝食べるパンを朝買えないなんて日々の糧を提供する店としていかがなものかと思うので、私のパン屋評価はそこも含めてなのです。イートインは中止中です。意気揚々とトング&トレーを持ったのは良いものの。…迷う！まよう！種類豊富でみんな美味しそうな顔で迷う！ああ楽しい。結局以下の3点を購入しました。★　れんこんとスモークチキンのタルティーヌ　480円チキンは完全に脇役。れんこんの圧すごい。一回素通りしましたが、圧凄すぎてつい手にとってしまいました(笑)。しゃっきりボリボリな触感が好き過ぎる。ちょっと味見を、と思っただけなのに、好きすぎて間違えて完食しちゃいました。具を支えるバゲットはごく薄め。ここまで薄いの珍しいけど、パン～具までガブッといきやすく、具とのバランスを思ったらこの薄さ素晴らしい。★　ベーコンエピ　350円パン生地がもっちりで美味しいのもさることながら、ベーコンが異様においしい！！芦屋メツゲライクスダさんのベーコンだとか。(関西のシャリキュトリー知らないのごめん)ベーコンの脂が付いたパンの端くれで呑めるレベルに美味しい！(わたくしゲコですが)ここまで食べてわかった。ここのパン屋さん「うちの酵母すごいやろほれ！」ってタイプじゃなくて、アシストに徹する事もできる包容力のあるパン屋さんなのかも。★　国産レモンのくるくる甘いのも買ってみました。全粒粉のクロワッサンに、アーモンドクリーム、レモン。意外とどっしりで、バターの旨みも感じます。,女性・東京都
889,00000045,パンデュース,3.79,東京都内,641,【大阪／本町】ハード系おかずパンが充実した美味しいパン屋さん～《パンデュース》焼肉《万両》へ行く前に、久しぶりに《パンデュース》さんへ寄り道ハード系・スイーツ系・食事系と何でも揃う超人気店なだけに夕方だけどパンは残ってるかなぁ…早く行かねば！C=C=＼(;・_・)／ｲｿｹﾞ！店内に入ると、思ったよりパンがありました～(* ﾟ∀ﾟ)パンデュースさんのハード系パンが好き！どっさりと旬の野菜を使ったヘルシーなパンが並んでいます最近はバケットもよく食べるので、バケットは買わなくちゃ～(o>ω<o)〈購入したパン〉○アドバケット○安納芋のガレット○もちもちあんぱん安納芋はごろんと大きくカット、素材そのままの味が口に広がりますバケットはクープが大胆に開いていて、すらーったした姿がきれいです♪塩加減が少し多く感じるとても美味しいバケットでした小麦粉や自家製天然酵母にこだわる美味しいパンが味わえて大満足♪ごちそうさま(*^-゜)vThanks!,女性
890,00000045,パンデュース,3.79,東京都内,641,明日の朝ごはんのパンを買おうと寄ってみました。夕方だったけど、沢山パンがあって嬉しい♡しかもお客さんが少なくてゆっくり選べました。目移りしちゃって、長い時間ウロウロしましたよ(๑˃̵ᴗ˂̵)小松菜とカリカリベーコン自家製ホワイトソース350円小松菜のシャキシャキ感が心地いい♡でも少しだけ味が薄く感じたので、小松菜にもう少し味付けして欲しかったなーと思いました。ホワイトソースは抜群の美味しさでした♡生地も旨味が強くて美味しかった♡♡ペイザンヌシート自家製ヨーグルト入り　210円少しだけトーストして食べました。あら、びっくり！酸味が非常に強い！これがヨーグルトの酸味なんですね(o^^o)パンの知識がないので知らないけど、ヨーグルトを混ぜて酸味を付けるのはスタンダードなのかな？初めて食べましたが、酸味、いいですね♡ハムとか挟んでサンドイッチにしたら合いそう！国産レモンのくるくる瀬戸内産レモンピールとアーモンドクリーム、全粒粉100%のクロワッサン　280円クロワッサン生地が、サクサク！しっとり！レモンピールの爽やかさとクリームのコクがバッチリ合います。とっても美味しかった♡♡この後、少しだけ歩く予定をしてたので形が崩れにくいものを選びましたが、お野菜たっぷりのお惣菜パンも買いたかったなー！次回は惣菜パン沢山買っちゃお♡♡美味しかったです。ご馳走さまでした。,女性・大阪府
891,00000045,パンデュース,3.79,東京都内,641,本町のホテルに泊まったのだが朝食を付け忘れていた。近場に何か無いかと検索すると美味そうなパン屋がある。大阪のメインストリートである御堂筋の脇に入ったところにあるお店。本町駅から徒歩10分くらいといったところ。朝の9時ごろ。出勤客が減ったであろう時間を見計らってお店へ。お店は7.8人くらいは入れそうな広さ。美味しそうなお惣菜パンがたくさん並んでいます。気になったパンを確保。ちなみに紙袋は有料です。ホテルの部屋に戻り食べることに。緑黄色野菜のホットドッグとねぎパンを。ホットドッグはグリルされた野菜の甘味がソーセージの塩味とよく合います。ねぎパンは売り場で視覚に対する主張が強かったので購入しましたがめっちゃ美味いですね。こんな味なんだという見た目とのギャップが良いです。本町はカレー屋が多いイメージでしたので、こんな良いパン屋さんがあるとは思いませんでした。本町はビジネス街なので、出張で来たおっちゃん達にもぜひ試してほしいですね。,20代後半
892,00000045,パンデュース,3.79,東京都内,641,夜勤明け…。朝ご飯を食べようと仕事中から考えてました（笑）次お邪魔するのが555店舗目でしたので、牛丼チェーン店はやめようと(￣∇￣)そこで思いついたのが、本町にあるパンデュースさんに決めました。チャリで自宅帰る時間から5分くらい遠回りをして向かいました。到着すると2人のお客さんがいました。入店すると3密を避ける、マスク着用の張り紙がありました。トレー横にはアルコール消毒配備。まだまだコロナ終息は先そうですね_:(´ཀ`」 ∠):まずぐるっとパンを拝見しました。スタンダードなパンから惣菜パン…見るからに美味しそうですが、高いっ！500円近くする惣菜パンがずらっと(￣∇￣)初めて入るパン屋さんはクリームパンとクロワッサンを食べる私。バカ舌ですか、小麦粉の味、バター、自家製クリームの味で次があるか決めます(￣∇￣)しかしパンデュースさん…2020年100名店に選ばれているので間違いないので惣菜パンを選ぶ事にしました。◼️クロックムッシュ 1/2210円◼️タルティーヌ480円◼️手さげ袋10円合計700円なかなかしますねー自宅に戻って食べようと思いましたが、良い天気でしたので家近所の横堀公園で食べる事に\(//∇//)\朝から作業着のおっさんが公園でパン(￣∇￣)しかもパンデュースさんのパン(*≧∀≦*)まずはクロックムッシュから…温めて食べたら絶対美味しい！自家製ホワイトソースが超濃厚ではないですが、コクがありハムとチーズの相性抜群(￣∇￣)タルティーヌを…有精卵のふわふわ…とにかく柔らかい！季節の野菜…インゲン？何が入ってたか、わっかりませーん（笑）美味しく頂きましたが、全くお腹にたまりません！家帰って何か食べよう\(//∇//)\ご馳走さまでした。,男性・大阪府
893,00000045,パンデュース,3.79,東京都内,641,"「PAINDUCE」とは、フランス語の[le pain]と、英語の[produce]をあわせた言葉。基本を大切にしながらも、あらゆる角度から これまでの見方を変えていくことで、 新たなパンの可能性を生み出していきたいという想いが込められているそうです！お店へは大阪メトロ淀屋橋駅から徒歩4,5分で到着しました。店内には野菜のパンを中心とした沢山の種類のパン‼︎選ぶの迷いますね...。その中から、この日選んだのは...◎クロワッサン北海道はるゆたか・石うすびき・全粒粉100%外はパリパリ、中はしっとり。全粒粉の香りがいい感じ♪大人のクロワッサンです！◎くるみパンシンプルな山食の生地にくるみをたっぷり混ぜ込みました。とても香ばしく、くるみの味がアクセントになって、パンが甘く感じます。◎オリーブパングリーンオリーブをたっぷり混ぜ込んだフランスパン。ワインのお供に。柔らかいタイプのフランスパン。中にはオリーブがたっぷり。本当、ワインとピッタリでしたねー♪◎ほうれん草と黒ごま・チーズのフォッカッチャフレッシュなほうれん草をざくざくと練り込みました。ほうれん草の香りがいい感じ。外側は黒ごま、チーズの香ばしい感じ。中はしっとり。こちらも大人のフォッカッチャです。“旬”の野菜を美味しい「パン」と一緒に楽しめる素晴らしいお店でした♪ご馳走さまでした！",50代前半・男性・大阪府
