,store_id,store_name,score,ward,review_cnt,review,user_info
585,00000030,ロートンヌ 中野店,3.82,東京都内,222,"当店のオーナーの神田広達氏は、練馬区の「ら・利す帆ん」で4年間修行。2年上の先輩はモンサンクレールの辻口博啓氏。1年上の先輩はユウジアジキの安食雄二氏という錚々たる職人を輩出した系譜。辻口氏は洋菓子、ロールケーキ、ショコラ、和菓子、コンフィチュール等、事業拡大に邁進。ドリカム好きの安食氏は日本屈指の人気と評価を誇るパティスリーのオーナー。当店は使い勝手、味、価格、接客のバランスのいい良店。様々な種類、価格帯の洋菓子を用意。上質な洋菓子を楽しみたい方のニーズに幅広く対応。勿論上質なのだが、ピンの逸品、スペシャリテを作り出すというより、万人に受け容れられる街のケーキ店の延長線の店を敢えて目指している気がする。修行店のベクトルを継承することを意識しているのではと感じた。当店はほぼ練馬区だが住所は中野区。西武池袋線の江古田から歩けるが最寄は大江戸線。修行店への愛着と練馬区に出店することを躊躇う複雑な感情を映しているような気がするのは考え過ぎだろうか？■頂いた品・味～価格は税込表示。2種の品を購入。印象順に記載。・エキゾティック(☆3.9)486円　ホワイトチョコのムースがメイン。　パッションフルーツが乗り、中にチョコ　しのばせてある。・クラン(☆3.5)594円　いちごとアーモンドの2種のクリームが　メイン。生クリームと苺が乗る。　なかなか美味。会計1,080円＜訪問記録＞■日時:2020年7月24日14:15頃。初訪。■場所・大江戸線新江古田駅A1出口から至近。・江原二丁目交差点(目白通りと江古田通りの交差点)　近く。any time、プジョーのディーラールームの　対面でマルエツの並び。■お店の状況・入口は目白通り沿いでなく裏手。・ホテルのような高級感のある内装。・イートインは休止中。・営業時間は11時～19時に短縮。　・店頭のショーケースの裏手が菓子製造場。・繁盛しているお店独特の活気あり。・焼菓子、ホールケーキ、生菓子、ゼリー等　多種類で様々な価格帯の品を揃える。・お店の方は余裕ある笑顔。感じのいい接客。・部厚いシフト。役割分担が明確で待っていて　安心感あり。・番号札を渡され、用意ができたら番号を呼ばれ　　会計するシステム。(2020年7月25日)・レビュー211件。3.76/マイレビュアー様8件。3.86",男性・東京都
586,00000030,ロートンヌ 中野店,3.82,東京都内,222,週末15:00頃訪問。2020.07でも未だにイートインは中止のまま。食べ歩きにはツラいっす。現在の営業時間は、11～19時。新江古田駅A1出口を出て、左手に20m行くとお店があります。駐車場もあって便利。田舎感ある立派な店舗で驚いちゃった。天井高もあり、都内とは思えぬゆったりとした作りの店舗です。焼き菓子からケーキまで、品数も多くて色々目移りしちゃいます。広い店だからか入店人数制限等はなく、ご近所さんばかりで混み合ってました。色んなシェフコートを着た店員さんが居たんだけど、ここのシェフが講習会でも主宰してるのかな？★　フレズノ　486円赤い方ね。苺の自然な風味を活かしたムース、ココナッツが優しいムース、アンビベしたしっとりジェノワ。んー。全部優しい。優しいと優しいを合わせると退屈になります。★　エキゾチック　486円黄色い方ね。ホワイトチョコムース、パッション、チョコジェノワ。見た目はかわいいけど、ピンクペッパーが蛇足。ならかなホワイトチョコムースの中に、酸味強めのパッションジュレが。コントラストがよい感じ。食べ進めるのが楽しい。チョコジェノワが昔臭いのが難点。わたしだったらチョコの種類変える。,女性・東京都
587,00000030,ロートンヌ 中野店,3.82,東京都内,222,外出ついでにロートンヌへ。17時過ぎ、ケーキがまだいろいろ残っていてどれにしようか迷う。・カッシーナ　540円・和栗のモンブラン　680円・まるごとグレープフルーツ　540円・マンゴープリン　700円・気まぐれシェフのケーキ　648円ロートンヌのケーキはどれを選んでもハズレがない。サイズも小ぶりで食べやすい。クリームも重くない。だから好き。今回の一番のお気に入りは気まぐれシェフのケーキ。結局フルーツタルトが一番好きなのかも。そういえば、以前箱に書かれていた「明日食べても大丈夫だョ」の一言はいつからなくなったのだろう…。,40代前半・女性・東京都
588,00000030,ロートンヌ 中野店,3.82,東京都内,222,目白通りから路地に入ってすぐにある洋菓子屋さん。目白通りに向けて、こちらに駐車場があると案内看板がある。以前から気づいていたが。看板の色合いが渋いのもあり目立つ訳じゃない。どうも間合いが合わない。ずっと気になっていた。最近、一週間に一度通過する用事がありそれでもなかなか行けずにいた。ようやく間合いが合い、路地に入る。お店の前に三角地帯の駐車場です。前後に通り道があるので、留める位置に要注意。車を止めて店内に。扉を開いて、目の前に消毒剤あり。店内は天井高くスィーツ専門店としてクオリティの高い素敵な店内。とても広くソファがいくつか点在しているが。カフェとしての機能はない。焼き菓子、ショコラ、ケーキと揃っている。これから伺う手土産にケーキを購入。それと別に自宅用も（笑）ケーキオーソドックスな苺ショートから季節をふまえた独創的なケーキまで価格は500前後から果物をふんだんに使われた800円くらいまで苺ショート苺は甘く、生クリームは私の好みに準ずるレベルフレッシュにしては少しもったり感がある。チョコレート小箱入り。二種類のアーモンドショコラビジュアル良し。チョコレートとアーモンドのコラボが絶妙。チョコの中にあってカリッとしたアーモンドが秀逸。これはリピ確実な一品。マカロン最近、マカロンにハマっておりあちこちで購入している。明瞭に記載されている材料がわからないタイプでした。店内ぎっしりスィーツが揃い選ぶのに目移りしてしまうラインナップ。お土産にするにも、ご自宅で楽しむにも好みに合えばクオリティが高いと思います。また伺いたい一軒家スィーツです。,女性・東京都
589,00000030,ロートンヌ 中野店,3.82,東京都内,222,最近サンマルクにハマッてる関係で当店のことを思い出してしまった。何度か買ってるが、自分では食べられないパターンの土産か、スイーツ会では自分以外の人に配当されちゃって。女性ばかりの場では茶色いものは残る傾向があるけど、これは何か見た目の訴求力があるんだな。お、これは何か柑橘系の香りが仕込んであるような？ギュッとした酸味というか、こないだの稲村シェフのところのチョコケーキにも似た感覚が！味の総和は軽やかなのに、濃密さが仕込まれたパートがある。こういうメリハリが名店たるゆえんか。コータツロール：シェフの名をここに持ってきたか！どっちかというと華美な印象の当店ですが、お店を象徴する存在にこのシンプルなロールケーキをもってきたということか。なるほど、口中わずかに押し返してくるようなしっとり×もっちりした生地の触感！D島ロールのようにはクリームばっかりじゃないところなどにも、このビスキュイにパティシエの本領や矜持が詰め込まれてるんだぜ！というメッセージが感じられる。アテネ：ミニ四駆世代ならつい手に取っちゃうようなピニオンギアが入ってるｗ。これはメレンゲの絞り焼き。サク…シュワっとほどける。メレンゲ＝卵白の印象から、焼く前はほわほわ頼りないもんなのかと思ってたけど、こういう形にも成型できるということはある程度まとまった硬度？軟度？なのがわかる。ヴェリーㇴの中身はプリン。おや、チーズ…プリン？どえらくチーズが主張しますね。んんん濃厚！こりゃあうまい！シェフの気まぐれ（ショコラ）：当店店頭には必ず何かがシェフの気まぐれとして売られてる。この日はこれともう一つ、忘れてしまったけど用意されてた。何か通常レシピとは異なる仕掛けが用意されてるのだろうか？む！このガナッシュには慣れ親しんだ香りがするような…ウイスキーですかね？かつてチョコとウイスキーで呑んでたものとしては黄金の組み合わせ！こりゃまた超絶うまいね！ミゼラブル：我が家の優秀な冷蔵庫に半日、ビシッと冷やしていただく。なぜなら、冷た～いバタークリームの層がスッと溶け、ゼイタクな味わいが広がる…。これを味わいたかった！名前の意味合いと全然違う豊かなケーキ。他店の経験も含め、このカタチ＝この味が条件反射のように記憶されつつある。今後ハマる気が…！サンマルク＝聖マルコ。かの国はカトリックの文化だと、のだめカンタービレで読んだけど、お菓子にも聖人シリーズみたいなもんが揃ってるんだろうか？ブロンディールにもサンジャック（ヤコブ）というお菓子があったし。12使徒＝聖人ならわが国でいう七福神みたいなもんかｗ。…人形焼かっ！,50代前半・男性・東京都
590,00000030,ロートンヌ 中野店,3.82,東京都内,222,ロートンヌ❤️一回目❤️焼き菓子セット購入美味しかった（好みの）順・フィナンシェピスターシュピスタチオのフィナンシェ丸い型に入っていて、金塊には見えませんwかなりしっとりしており、フィナンシェ型に成り立たないんだろうなという感じ。ピスタチオの味はあまり強くないですがしっとりした食感は美味しいです。・ショコラショコラ5月初旬でも暑い日が続いたおかげかチョコ部分は溶けてしまってました…見た目が残念なことに。でもたっぷりなチョコの味い甘めにさくっとしたクッキーが合っていて美味しい。・焼菓子（名前なし）ぱっと見、サンダースですがナッツのザクザク感と、たっぷりのチョコのザクザク感がマッチしていて美味しいです。一つで十分お腹いっぱいになります。・リーフパイ甘すぎずちょうどよい塩梅さくっとしており、硬すぎず脆すぎずの食感も良いです。・ボンボワイヤージュ・バウムクーヘンふわふわクーヘンです。卵の焼き菓子って味がします。・モナコ下の土台はパリっとしてる見た目ですがどちらかというとふにっとした最中。上のキャラメルは美味しいです。なんだか焼き菓子の完成度というか完全に好みの度合いが、かなり乱高下生ケーキを頂いたのは結構前になるので、また訪れたいです。,
591,00000030,ロートンヌ 中野店,3.82,東京都内,222,中野区にある人気ケーキ屋です！行くなら都営大江戸『新江古田駅』もしくは西武池袋線『江古田駅』からも徒歩圏内です。本店は東村山市秋津にあります。今回購入したのは「クロワッサン」¥260「eco田シューク(キャラメル)」¥216 の2つ。秋津本店の方でケーキ類は食べたことがあったので今回は変えてパンやシュークリームにしてみました^ ^クロワッサンは見た目がかなり大きいですが持ってみるとフワッと軽い。見た目も綺麗な焼き色をしてます(^^)フランス産バターを使用しているらしくバターの香りがめっちゃ良いですね！！しっとり食感。普通に10個は食べられそう。笑お次にシュークリーム。中にはたっぷりのクリームが入っています^ ^外はザクザクッといった食感。ちょっと焦がしたキャラメルの香りもしました。全体的に甘さはやや控えめで中からトロッと出てくるクリームが病みつきになりますね〜(´∀｀)♪店内は天井も高く、広々としておりさらにソファなんかもあってかなりお洒落な造りでした^ ^,東京都
592,00000030,ロートンヌ 中野店,3.82,東京都内,222,平日正午《感想》とても広々としたお店で、ショーケース中の種類も多くって、選ぶのに一苦労。ミルフィーユとモンブランを取り置きしてもらって、来店。シュークリームは予約で完売らしい。《テイクアウトしたケーキ》◯和栗のモンブラン ¥680モンブランクリームはねっとりで甘いメレンゲも甘め◯紫芋のモンブラン ¥540冬の期間限定かな？モンブランクリームは和栗より空気感あって軽めで、芋本来の甘みで甘さもほんの控えめ。◯ナポレいちごのミルフィーユ¥540期間限定のシェフの気まぐれケーキ小ぶりな外観。バター薫もふ．さくな生地甘いいちごに、たっぷりなバニラビーンズの濃厚なカスタードクリーム甘さ控えめ。最高に美味しかった。◯クランチ¥540マカロンの下には濃厚なバニラムースフランボワーズの酸味を合わせたチョコムースピーナッツバターのまろやかなしっとりスポンジサクサクなクランチのコーディングチョコ酸味とチョコで甘過ぎずフレッシュな感覚✨大江戸線新江古田駅から徒歩2分✨クレジットカード◯✨取り置き可能！（人気のシュークリーム、ミルフィーユなど）,20代前半・女性・東京都
593,00000030,ロートンヌ 中野店,3.82,東京都内,222,とある用事で親戚宅へ向かうことに。車で自宅を出てから手土産を用意し忘れた事に気付く( ﾟдﾟ)ﾊｯ!そこで急に思い立って駐車場のある行きたかったお店を思い出した！！新目白通りからその店の場所を確認してもあまりパッとしない感じだったが、回り込んだ駐車場側から見るととても立派で優雅な造り。しかし駐車場は狭い(^_^;)店頭の応接セットのような椅子とテーブルは飲食していいのか？それが許されたとしても、その勇気が君にあるのか？と試されている感じw大きな扉を開いて中に入ると、とても広い空間が広がっている。天井も高く高級感がある。正面の冷蔵ケースにケーキ達。周りの棚には焼き菓子達が沢山美しく並んでいる。どのケーキも魅惑的♡数点選び手土産とする。そしてふと思い出した！！ドンレミーでバレンタインを済ませてしまった夫が隣にいる事を！！ワタシ  「何でも好きなもの買ってあげるよ」夫         「それ言ってくれるの待ってた」ゴメン！すぐ気が付かなければいけなかったね。反省(;´д｀)ﾄﾎﾎ…そこで夫が選んだものは…● たっちゃんのおやつ     700円     ×2ショーケースの写真には写ってないけれど、実はプライスカードの後ろに2種類のケーキが並んでいた。□ ティラミス□ 苺とロールケーキ生地を使ったケーキプライスカードにスタッフかたっちゃんに聞いてね！もったいないもんシリーズと書いてあり、たっちゃん(誰？)が見当たらないので店員のお姉さんに声をかける。どうやらもったいないもんシリーズとあるだけあってアウトレット商品のよう。半端の生地やスポンジ、フルーツを使って作ったケーキをお得な価格で提供しているようだ。両方下さい！！保冷剤(無料)を入れて頂き、家に持ち帰った。正直、アウトレットだし…と思っていたけれどそれはやはり百名店の品だけある！！苺のカットも美しいし、ロールケーキのスポンジと説明されたケーキ生地はきめ細かくなめらかでとても美味しい♡ハッキリ言ってティラミスなんて大きな器に入れてくれているだけでそのまま美味しいのでまるまるお得！マスカルポーネチーズのクリームとほろ苦いエスプレッソの染み込んだスポンジ生地が口の中で溶け合う至福♡コレでそれぞれ700円！！！たっちゃんありがとう♡(誰？)食べログ百名店でありながら、食品ロスを無くすために努力していらしゃること、そしてそれを惜しみなくお手頃価格で提供されていること、その両方にただ安く買えたと言うだけでは無い感動を覚えた。素晴らしい！！次回はちゃんとしたケーキも買ってあげるからね〜♪,50代前半・女性・東京都
594,00000030,ロートンヌ 中野店,3.82,東京都内,222,雨の日曜日10時過ぎ、自宅への手土産で数年振りに訪問しました。こちらは駐車場があるので便利です｡■ガトーショコラ(486円税込)癖がなくてあっさり優しい甘さのチョコレートショートケーキです｡相性ぴったりの苺の魅力も引き立ちます。■クレームコルセ(432円税込)口溶けの良い滑らかな絶品プリンです｡微かにカラメルが香り、玉子とミルクの優しい風味で甘さ控えめの一品でした。,男性・東京都
595,00000030,ロートンヌ 中野店,3.82,東京都内,222,再びロートンヌでケーキを購入しました。今日はガトーショコラと紫いものモンブランを購入しました。　ガトーショコラは、スポンジケーキとクリームにチョコを使っていて、上にいちごが乗っており、ショートケーキのチョコレートバージョンのような見た目です。紫いものモンブランは、クリームの色が紫いもそのもので、かなり鮮やかな色です。　最初にガトーショコラをいただきました。ふわふわのチョコレートスポンジケーキとチョコクリームが口の中に広がります。スポンジよりもクリームの方が多く、チョコクリームをたっぷり味わえるケーキとなっています。　次に紫いものモンブランをいただきました。紫いもの香りと中に入った生クリームの滑らかさの違いがあります。モンブランの下にマカロンが敷かれていて、マカロンのサクッとした食感が味のアクセントになっています。栗のモンブランよりも香りという点で、物足りないような気もしました。　どちらのケーキも美味しかったです。他のケーキも食べてみたいです。,男性・東京都
596,00000030,ロートンヌ 中野店,3.82,東京都内,222,休日のお昼に伺いました。品揃えは以前と変わっていなかったものの、低価格帯でコストパフォーマンスが高い印象のお店だったが、以前食べた時より結構値上げしており半分以上が600円台の高価格帯になっていた。――――――――――――――――購入した商品等（税込）――――――――――――――――◇エピス（467円）　☆×3.5　構成：かぼちゃ生クリーム・ムース＋ビスキュイ＋生クリーム　かぼちゃ味の生クリームは水分多目でムースは水分少な目、合わせると上手く調和する。　かぼちゃ味は野菜の割とそのままの味、水分の多さから後味がさっぱりになるのが上手い。　ビスキュイは反発感のあるもの、スパイス味なのかな？他構成に対してやや強く浮き気味。◇その他　ロッソルビート　　　（600円）　☆×4.2　ムラング　シャンティ（480円）　☆×4.2　フレズノ　　　　　　（600円）　☆×3.9　エキゾティック　　　（486円）　☆×3.9　フロマージュクリュ　（600円）　☆×3.8　シャンテフレーズ　　（600円）　☆×3.8――――――――――――――――購入した商品等（税込）――――――――――――――――期間限定なのかわからないが、何故か以前は無かったいちごを載せているor増量しているケーキが多かったのが謎、以前無かったものに関しては調和的にいらない気しかしないのでうーん…以前中野店で酷かったサービス面は完全に改善されており、秋津店と同レベルまで上がっていた。ら・利す帆ん系譜の中では一番好きなお店、機会を作って再訪したい。総合点：3.8→3.8（増減なし)　／　以下は2017/08レビュー,男性・東京都
